<?xml version='1.0'?>

<!DOCTYPE rmssrace SYSTEM "/home/nash/work/rolemaster/XML/rmssrace/rmssrace.dtd">


<rmssrace>

	<data>
                <fixed>
                        <race>Urban man</race>
                </fixed>
                <raceinfo>
        		<exhaustionbonus>0</exhaustionbonus>
	        	<lifespan>65-85</lifespan>
		        <souldeparture>10</souldeparture>
        		<recoverymultiplier>1</recoverymultiplier>
	        	<racetype>2</racetype>
		        <startinglanguages>2</startinglanguages>
        		<talentpoints>50</talentpoints>
	        	<hobbyranks>12</hobbyranks>
		        <bodydevelopment>0&#x2022;6&#x2022;4&#x2022;2&#x2022;1</bodydevelopment>
        		<arcane>0&#x2022;6&#x2022;5&#x2022;4&#x2022;3</arcane>
	        	<channeling>0&#x2022;6&#x2022;5&#x2022;4&#x2022;3</channeling>
		        <essence>0&#x2022;6&#x2022;5&#x2022;4&#x2022;3</essence>
        		<mentalism>0&#x2022;7&#x2022;6&#x2022;5&#x2022;4</mentalism>
	        </raceinfo>
        </data>

	<stats>
		<stat>
			<abbr>Ag</abbr>
			<racial>0</racial>
		</stat>
		<stat>
			<abbr>Co</abbr>
			<racial>0</racial>
		</stat>
		<stat>
			<abbr>Me</abbr>
			<racial>0</racial>
		</stat>
		<stat>
			<abbr>Re</abbr>
			<racial>0</racial>
		</stat>
		<stat>
			<abbr>SD</abbr>
			<racial>2</racial>
		</stat>
		<stat>
			<abbr>Em</abbr>
			<racial>0</racial>
		</stat>
		<stat>
			<abbr>In</abbr>
			<racial>0</racial>
		</stat>
		<stat>
			<abbr>Pr</abbr>
			<racial>0</racial>
		</stat>
		<stat>
			<abbr>Qu</abbr>
			<racial>0</racial>
		</stat>
		<stat>
			<abbr>St</abbr>
			<racial>2</racial>
		</stat>
		<stat>
			<abbr>Ap</abbr>
			<racial>0</racial>
		</stat>
	</stats>
	<rrs>
		<rr>
			<name>Essence</name>
			<racialbonus>0</racialbonus>
		</rr>
		<rr>
			<name>Channeling</name>
			<racialbonus>0</racialbonus>
		</rr>
		<rr>
			<name>Mentalism</name>
			<racialbonus>0</racialbonus>
		</rr>
		<rr>
			<name>Poison</name>
			<racialbonus>0</racialbonus>
		</rr>
		<rr>
			<name>Disease</name>
			<racialbonus>0</racialbonus>
		</rr>
		<rr>
			<name>Fear</name>
			<racialbonus>0</racialbonus>
		</rr>
		<rr>
			<name>Heat</name>
			<racialbonus>0</racialbonus>
		</rr>
		<rr>
			<name>Cold</name>
			<racialbonus>0</racialbonus>
		</rr>
	</rrs>

	<skills>
		<category>
		<name>Armor &#x2022; Light</name>
		<ranks>1</ranks>
		</category>
		<category>
		<name>Athletic &#x2022; Brawn</name>
		<ranks>1</ranks>
		</category>
		<category>
		<name>Athletic &#x2022; Endurance</name>
		<ranks>1</ranks>
            <skill>
            <name>Swimming</name>
            <ranks>1</ranks>
            </skill>
		</category>
		<category>
		<name>Athletic &#x2022; Gymnastics</name>
		<ranks>1</ranks>
		</category>
		<category>
		<name>Awareness &#x2022; Perceptions</name>
			<skill>
			<name>Alertness</name>
			<ranks>2</ranks>
			</skill>
		</category>
		<category>
		<name>Awareness &#x2022; Searching</name>
		<ranks>1</ranks>
		</category>
		<category>
		<name>Body Development</name>
		<ranks>1</ranks>
		</category>
		<category>
		<name>Communications</name>
		<ranks>3</ranks>
	    <skillgroup>
                <name>Language Spoken</name>
                <skill><name>Common Speech</name><ranks>8</ranks></skill>
        </skillgroup>
    	<skillgroup>
                <name>Language Written</name>
                <skill><name>Common Speech</name><ranks>4</ranks></skill>
        </skillgroup>
		</category>
		<category>
		<name>Lore &#x2022; General</name>
		<ranks>3</ranks>
			<skillgroup>
			<name>Culture Lore (By Culture/Race)</name>
			<skill>
				<name>Common men</name>
				<ranks>3</ranks>
			</skill>
			</skillgroup>
			<skillgroup>
			<name>Region Lore (By Region)</name>
			<skill>
				<name>A region</name>
				<ranks>3</ranks>
			</skill>
			</skillgroup>
		</category>
		<category>
		<name>Outdoor &#x2022; Environmental</name>
		<ranks>1</ranks>
		</category>
        <category>
        <name>Power Awareness</name>
        <ranks>2</ranks>
        </category>
        <category>
        <name>Science/Analytic &#x2022; Basic</name>
        <ranks>1</ranks>
        </category>
        <category>
        <name>Spells &#x2022; Own Realm</name>
            <skill>
            <name>One spell list</name>
            <ranks>2</ranks>
            </skill>
        </category>
		<category>
		<name>Tech/Trade &#x2022; General</name>
		<ranks>1</ranks>
		</category>
        <category>
                <name>Urban</name>
                <ranks>5</ranks>
        </category>
        <category>
		<name>Weapon &#x2022; 1H Edged</name>
		<ranks>1</ranks>
			<skill>
			<name>A Weapon</name>
			<ranks>1</ranks>
			</skill>
		</category>
		<category>
		<name>Weapon &#x2022; Missile</name>
		<ranks>1</ranks>
			<skill>
			<name>A Weapon</name>
			<ranks>1</ranks>
			</skill>
		</category>
	</skills>

        <choices>
                <choice>
                    <title>Select Languages</title>
                    <multiple />
                    <ranks>10</ranks>
                    <group>Communications</group>
                    <!-- Fixme: Should list specific languages -->
                </choice>
        </choices>
</rmssrace>

